run_id,branch,date,dataset_variant,tokenizer_variant,core_hparams,hardware,val_loss,val_bpb,bytes_model,bytes_code,bytes_total,notes,track_intent,code_path,wallclock_target
baseline_sp1024_h100_local_20260319,main,2026-03-19,fineweb10B_sp1024,fineweb_1024_bpe.model,seq1024 9x512 kv4 mlp_mult2 tied_emb baseline_schedule,1xH100,2.23418658,1.32321114,13990174,47686,14037860,user-provided parsed baseline summary; stop_reason=wallclock_cap; stop_step=1444; compare anchor for 1xH100 ablations,non-record,train_gpt.py,600s
ablate_control_1xh100_1024,main,2026-03-20,fineweb10B_sp1024,fineweb_1024_bpe.model,seq1024 9x512 kv4 mlp_mult2 tied_emb baseline_schedule,1xH100,2.23142415,1.32157507,13956270,48294,14004564,control run near the current local 1xH100 baseline path; stop_reason=wallclock_cap; stop_step=1506; delta_val_bpb_vs_local_1xh100_baseline=-0.00163607,non-record,train_gpt.py,600s
ablate_fp16_embed_1xh100_1024,main,2026-03-20,fineweb10B_sp1024,fineweb_1024_bpe.model,seq1024 9x512 kv4 mlp_hidden992 keep_float=tok_emb.weight,1xH100,2.23533834,1.32389328,13990263,48294,14038557,leaderboard-informed export ablation: keep tied embedding in fp16 and trim MLP slightly for size headroom; stop_reason=wallclock_cap; stop_step=1468; delta_val_bpb_vs_local_1xh100_baseline=+0.00068214,non-record,train_gpt.py,600s
ablate_lr_warmdown_1xh100_1024,main,2026-03-20,fineweb10B_sp1024,fineweb_1024_bpe.model,seq1024 9x512 kv4 mlp_mult2 warmdown3600 matrix_lr0.06,1xH100,2.22723152,1.31909196,12407251,48294,12455545,leaderboard-informed optimization ablation: longer warmdown and higher matrix LR for the under-stepped 1xH100 path; stop_reason=wallclock_cap; stop_step=1512; delta_val_bpb_vs_local_1xh100_baseline=-0.00411918,non-record,train_gpt.py,600s
ablate_compound_ctx1536_1xh100,main,2026-03-20,fineweb10B_sp1024,fineweb_1024_bpe.model,seq1536 10x480 kv4 mlp_hidden896 balanced_compound_probe,1xH100,2.23752659,1.32518999,12789854,48621,12838475,"balanced scaling probe: slightly deeper, narrower, smaller MLP, and longer context without changing dataset or eval rules; stop_reason=wallclock_cap; stop_step=1330; delta_val_bpb_vs_local_1xh100_baseline=+0.00197885; initial seq1536 loader bug fixed by rounding local_tokens down to whole sequences before rerun",non-record,train_gpt.py,600s
ablate_lr_warmdown_1xh100_20260320_runpod,main,2026-03-20,fineweb10B_sp1024,fineweb_1024_bpe.model,seq1024 9x512 kv4 mlp_mult2 warmdown3600 matrix_lr0.06,1xH100 Runpod NVIDIA H100 80GB HBM3,2.24664078,1.33058722,11991857,61795,12053652,Runpod remote rerun on pod 9p5aq98sa8j6go via SSH using official parameter-golf image; stop_reason=wallclock_cap; stop_step=1343; delta_val_bpb_vs_local_1xh100_baseline=+0.00737608,non-record,train_gpt.py,600s
