run_id,branch,date,dataset_variant,tokenizer_variant,core_hparams,hardware,val_loss,val_bpb,bytes_model,bytes_code,bytes_total,notes,track_intent,code_path,wallclock_target
baseline_sp1024_h100_local_20260319,main,2026-03-19,fineweb10B_sp1024,fineweb_1024_bpe.model,seq1024 9x512 kv4 mlp_mult2 tied_emb baseline_schedule,1xH100 Runpod pod,2.23418658,1.32321114,13990174,47686,14037860,user-provided parsed baseline summary from a Runpod 1xH100 pod; legacy run_id retains _local_ for compatibility; stop_reason=wallclock_cap; stop_step=1444; compare anchor for 1xH100 ablations,non-record,train_gpt.py,600s
ablate_control_1xh100_1024,main,2026-03-20,fineweb10B_sp1024,fineweb_1024_bpe.model,seq1024 9x512 kv4 mlp_mult2 tied_emb baseline_schedule,1xH100 Runpod pod,2.23142415,1.32157507,13956270,48294,14004564,provisional legacy control anchor near the historical Runpod 1xH100 path; raw log/result packet not preserved locally; canonical compare JSON is mirrored from this ledger row with inferred ac7e33d export-family lineage; stop_reason=wallclock_cap; stop_step=1506; delta_val_bpb_vs_runpod_1xh100_control_anchor=-0.00163607,non-record,train_gpt.py,600s
ablate_fp16_embed_1xh100_1024,main,2026-03-20,fineweb10B_sp1024,fineweb_1024_bpe.model,seq1024 9x512 kv4 mlp_hidden992 keep_float=tok_emb.weight,1xH100,2.23533834,1.32389328,13990263,48294,14038557,leaderboard-informed export ablation: keep tied embedding in fp16 and trim MLP slightly for size headroom; stop_reason=wallclock_cap; stop_step=1468; delta_val_bpb_vs_runpod_1xh100_control_anchor=+0.00068214,non-record,train_gpt.py,600s
ablate_lr_warmdown_1xh100_1024,main,2026-03-20,fineweb10B_sp1024,fineweb_1024_bpe.model,seq1024 9x512 kv4 mlp_mult2 warmdown3600 matrix_lr0.06,1xH100,2.22723152,1.31909196,12407251,48294,12455545,leaderboard-informed optimization ablation: longer warmdown and higher matrix LR for the under-stepped 1xH100 path; stop_reason=wallclock_cap; stop_step=1512; delta_val_bpb_vs_runpod_1xh100_control_anchor=-0.00411918,non-record,train_gpt.py,600s
ablate_compound_ctx1536_1xh100,main,2026-03-20,fineweb10B_sp1024,fineweb_1024_bpe.model,seq1536 10x480 kv4 mlp_hidden896 balanced_compound_probe,1xH100,2.23752659,1.32518999,12789854,48621,12838475,"balanced scaling probe: slightly deeper, narrower, smaller MLP, and longer context without changing dataset or eval rules; stop_reason=wallclock_cap; stop_step=1330; delta_val_bpb_vs_runpod_1xh100_control_anchor=+0.00197885; initial seq1536 loader bug fixed by rounding local_tokens down to whole sequences before rerun",non-record,train_gpt.py,600s
ablate_lr_warmdown_1xh100_20260320_runpod,main,2026-03-20,fineweb10B_sp1024,fineweb_1024_bpe.model,seq1024 9x512 kv4 mlp_mult2 warmdown3600 matrix_lr0.06,1xH100 Runpod NVIDIA H100 80GB HBM3,2.24664078,1.33058722,11991857,61795,12053652,Runpod remote rerun on pod 9p5aq98sa8j6go via SSH using official parameter-golf image; stop_reason=wallclock_cap; stop_step=1343; delta_val_bpb_vs_runpod_1xh100_control_anchor=+0.00737608,non-record,train_gpt.py,600s
ablate_control_1xh100_20260320_runpod_retry2,main,2026-03-20,fineweb10B_sp1024,fineweb_1024_bpe.model,seq1024 9x512 kv4 mlp_mult2 tied_emb baseline_schedule,1xH100 Runpod NVIDIA H100 80GB HBM3,2.25439935,1.33518228,13611740,61795,13673535,Fresh single-pod Runpod H100 SXM control rerun retry2 after earlier control failure; same wrapper path and unchanged sp1024 dataset/tokenizer; stop_reason=wallclock_cap; stop_step=1282; delta_val_bpb_vs_runpod_1xh100_control_anchor=+0.01197114,non-record,train_gpt.py,600s
ablate_control_1xh100_20260320_runpod_stabilize,main,2026-03-20,fineweb10B_sp1024,fineweb_1024_bpe.model,seq1024 9x512 kv4 mlp_mult2 tied_emb baseline_schedule,1xH100 Runpod NVIDIA H100 80GB HBM3,2.27686994,1.34849063,12878462,61795,12940257,Fresh single-pod Runpod H100 SXM control stabilization rerun on pod vlmy3ngmeqbq96 at main@bc75d7b0c350a41af25131232854833340265e86; same wrapper path and unchanged sp1024 dataset/tokenizer; stop_reason=wallclock_cap; stop_step=1152; delta_val_bpb_vs_runpod_1xh100_control_anchor=+0.02691556; delta_val_bpb_vs_legacy_runpod_baseline_summary=+0.02527949,non-record,train_gpt.py,600s
ablate_control_1xh100_20260320_runpod_stable,main,2026-03-20,fineweb10B_sp1024,fineweb_1024_bpe.model,seq1024 9x512 kv4 mlp_mult2 tied_emb baseline_schedule,1xH100 Runpod NVIDIA H100 80GB HBM3,2.28415990,1.35280815,12435489,61795,12497284,Stable-profile control rerun on pod 474jlphqpo5n8x in US-MO-1 after failed restart attempts on 9p5aq98sa8j6go xgi77lp1vapny8 and zzp4jchfuh2ky3; pinned main@bc75d7b0c350a41af25131232854833340265e86; stop_reason=wallclock_cap; stop_step=1145; delta_val_bpb_vs_runpod_1xh100_control_anchor=+0.03123308; no surrogate ablation run because control gate failed,non-record,train_gpt.py,600s
ablate_control_1xh100_20260321_runpod_frozen_anchor_a,detached,2026-03-21,fineweb10B_sp1024,fineweb_1024_bpe.model,seq1024 9x512 kv4 mlp_mult2 tied_emb baseline_schedule,1xH100 Runpod NVIDIA H100 80GB HBM3,2.2450297,1.32963305,13487253,61795,13549048,First provenance-hardened same-pod control rebuild on reused stable-profile pod 474jlphqpo5n8x after recloning the repo stub and applying the minimal wrapper/provenance overlay.,non-record,train_gpt.py,600s
ablate_control_1xh100_20260321_runpod_frozen_anchor_b,detached,2026-03-21,fineweb10B_sp1024,fineweb_1024_bpe.model,seq1024 9x512 kv4 mlp_mult2 tied_emb baseline_schedule,1xH100 Runpod NVIDIA H100 80GB HBM3,2.24188124,1.32776835,13625409,61795,13687204,Second provenance-hardened same-pod control rerun on reused stable-profile pod 474jlphqpo5n8x; best rebuilt-control metric of the session but still above the provisional-legacy +0.005 gate.,non-record,train_gpt.py,600s
ablate_control_1xh100_20260321_runpod_frozen_anchor_c,detached,2026-03-21,fineweb10B_sp1024,fineweb_1024_bpe.model,seq1024 9x512 kv4 mlp_mult2 tied_emb baseline_schedule,1xH100 Runpod NVIDIA H100 80GB HBM3,2.25364497,1.3347355,13710371,61795,13772166,"Third provenance-hardened same-pod control rerun on reused stable-profile pod 474jlphqpo5n8x; regression after the near-recovery second run, so no surrogate ablation was launched.",non-record,train_gpt.py,600s
baseline_sp1024_1xh100_20260320_integrated_main,main,2026-03-20,fineweb10B_sp1024,fineweb_1024_bpe.model,seq1024 9x512 kv4 mlp_mult2 tied_emb baseline_schedule,1xH100 Runpod NVIDIA H100 80GB HBM3,2.27752993,1.34888151,12779211,61795,12841006,Fresh official-template 1xH100 baseline reproduction on exact local main ea0df59713d6288526ab88ee1f316692da188356 via git bundle after replacing the stub repo checkout; delta_val_bpb_vs_runpod_1xh100_control_anchor=+0.02730644; stop_reason=wallclock_cap; stop_step=1136,non-record,train_gpt.py,600s
control_path_diagnosis_20260321_fresh_template_runpod,main,2026-03-21,fineweb10B_sp1024,fineweb_1024_bpe.model,seq1024 9x512 kv4 mlp_mult2 tied_emb baseline_schedule,1xH100 Runpod NVIDIA H100 80GB HBM3,2.28421247,1.35283929,12747081,61795,12808876,"Fresh official-template US-MO-1 H100 control diagnosis on new pod vhrzxwizzi276z after bounded checkout recovery from a stub template in 3.704s. final_int8_zlib_roundtrip_exact val_bpb=1.35283929, which is +0.00395778 worse than baseline_sp1024_1xh100_20260320_integrated_main and +0.00003114 from ablate_control_1xh100_20260320_runpod_stable.; stop_reason=wallclock_cap; stop_step=1107; delta_val_bpb_vs_runpod_1xh100_control_anchor_summary=+0.03126422",non-record,train_gpt.py,600s
control_path_warm_state_pair_20260321_run1,main,2026-03-21,fineweb10B_sp1024,fineweb_1024_bpe.model,seq1024 9x512 kv4 mlp_mult2 tied_emb baseline_schedule warm_state_pair_run1,1xH100 Runpod NVIDIA H100 80GB HBM3,2.26193109,1.339643,13282369,61795,13344164,Fresh official-template 1xH100 warm-state pair run 1 of 2. Local run.log reconstructed verbatim from captured SSH stdout after the zero-volume pod lost its remote log directory on post-run restart.; stop_reason=wallclock_cap; stop_step=1258; delta_val_bpb_vs_runpod_1xh100_control_anchor=+0.01806793,non-record,train_gpt.py,600s
control_path_warm_state_pair_20260321_run2,main,2026-03-21,fineweb10B_sp1024,fineweb_1024_bpe.model,seq1024 9x512 kv4 mlp_mult2 tied_emb baseline_schedule warm_state_pair_run2,1xH100 Runpod NVIDIA H100 80GB HBM3,2.25837801,1.33753867,13240714,61795,13302509,Fresh official-template 1xH100 warm-state pair run 2 of 2. Local run.log reconstructed verbatim from captured SSH stdout after the zero-volume pod lost its remote log directory on post-run restart.; stop_reason=wallclock_cap; stop_step=1283; delta_val_bpb_vs_runpod_1xh100_control_anchor=+0.01596360,non-record,train_gpt.py,600s
smeargate_bigramhash_mlp3x_warmprobe_20260321_run1_control,main,2026-03-21,fineweb10B_sp1024,fineweb_1024_bpe.model,seq1024 9x512 kv4 mlp_mult2 tied_emb baseline_schedule warmup_before_smeargate_probe,1xH100 Runpod NVIDIA H100 80GB HBM3,2.27868765,1.34956718,12781623,61795,12843418,Fresh official-template 1xH100 warm-up control on pod aagwbrm1z1rrej before the SmearGate/BigramHash/MLP3x probe; local log copied off the zero-volume pod before shutdown.; stop_reason=wallclock_cap; stop_step=1131,non-record,train_gpt.py,600s
smeargate_bigramhash_mlp3x_warmprobe_20260321_run2_model,main,2026-03-21,fineweb10B_sp1024,fineweb_1024_bpe.model,seq2048 9x512 kv4 mlp_mult3 int6 smeargate bigramhash4096 dim128 tied_emb muon_wd swa stride64,1xH100 Runpod NVIDIA H100 80GB HBM3,2.52864608,1.4976106,87413467,52243,16290010,"Warmed second-run surrogate probe on the same fresh official-template pod aagwbrm1z1rrej after a baseline warm-up control. The remote shell-script copy initially failed because of CRLF line endings; the copied shell and Python helper files were normalized to LF before the successful run. Counted int8+zlib size exceeded the 16000000-byte challenge cap by 290010 bytes, so this is strictly a negative surrogate record, not a candidate packaging path.; stop_reason=wallclock_cap; stop_step=968; delta_val_bpb_vs_smeargate_probe_warmup_control=+0.14804342; delta_eval_time_ms_vs_warmup_control=+1209405",non-record,records/track_10min_16mb/2026-03-20_Int6_MLP3x_SmearGate_BigramHash_MuonWD_SWA/train_gpt.py,600s
ablate_shared_depth_stable_1xh100_retry1,main,2026-03-21,fineweb10B_sp1024,fineweb_1024_bpe.model,seq1024 shared_depth cyclic unique3 passes9 resid_scale=inv_sqrt_reuse,Runpod 1xH100 pod,2.39696185,1.41961582,4868507,72579,4941086,Fresh same-pod shared-depth control under patched train_gpt.py for TTC comparison.; stop_reason=wallclock_cap; stop_step=1409; delta_val_bpb_vs_fresh_template_control_path=+0.06677653,non-record,train_gpt.py,600s
acher skip-weight overrun fix.,non-record,train_gpt.py,600s,,,,,,,,,,,,
ablate_shared_depth_ttc_rsd_lite_1xh100_retry1,main,2026-03-21,fineweb10B_sp1024,fineweb_1024_bpe.model,seq1024 shared_depth cyclic unique3 passes9 resid_scale=inv_sqrt_reuse ttc_rsd teacher11 every4 lambda0.05 warmup100,Runpod 1xH100 pod,2.42229808,1.43462137,4496338,72661,4568999,Fresh same-pod TTC recurrent self-distillation retry after teacher skip-weight overrun fix.,non-record,train_gpt.py,600s
